,affilID,affiliation
375,376,"Software and Systems Group, IT University of Copenhagen, Copenhagen, Denmark"
376,377,"University of Groningen, Netherlands  2  Linnaeus University, Sweden  3  Fraunhofer IESE, Germany"
377,378,"Institute of Computer Science, University of Tartu J , Liivi 2, Tartu, Estonia"
378,379,"Information and Computing Sciences, Utrecht University, Netherlands"
379,380,"Gloin, Calle de las Ocas 2, C ceres, Spain  2  Department of Computer Science, University of M laga, Spain"
380,381,"Oak Ridge National Laboratory, 1 Bethel Valley Rd , Oak Ridge, TN, United States"
381,382,"Department of Informatics, University of Zurich, Zurich, Switzerland"
382,383,"NICTA, Australia Technology Park, Eveleigh, Australia, School of Computer Science and Engineering, University of New South Wales, Australia"
383,384,"Oxford E Research Centre, University of Oxford, Oxford, United Kingdom  2  Department of Computer Science, University of Oxford, Oxford, United Kingdom  3  Brunel Institute of Power Systems, Brunel University, London, United Kingdom  4  Open Grid Systems Ltd , Glasgow, United Kingdom"
384,385,"Dept  of Computer Systems, University of S o Paulo   USP, PO Box 668, 13560 970, S o Carlos, SP, Brazil"
385,386,"National Institute for Health and Welfare, Helsinki, Finland"
386,387,"ABB Corporate Research, Industrial Software Systems, Segelhofstrasse 1K, CH 5405 Baden D ttwil, Switzerland"
387,388,"FZI Research Center for Information Technologies, Haid und Neu Str  10 14, 76131 Karlsruhe, Germany"
388,389,"Tampere University of Technology, Korkeakoulunkatu 1, FI 33720 Tampere, Finland"
389,390,"Fraunhofer Institute for Experimental Software Engineering, 67663 Kaiserslautern, Germany"
390,391,"Free University of Bozen Bolzano, Piazza Domenicani, 3, I 39100 Bolzano, Italy  2  University of Helsinki, PO Box 68, FI 00014, Helsinki, Finland"
391,392,"Tampere University of Technology, P O  Box 553, 33101 Tampere, Finland"
392,393,"Department of Computer Engineering, Bilkent University, Ankara, Turkey  2  Department of Computer Engineering, Ozyegin University, Istanbul, Turkey"
393,394,"School of Computing, Dublin City University, Ireland Lero   the Irish Software Engineering Research Center, Ireland"
394,395,"Key Lab  of Coal to Ethylene Glycol   Its Related Technol , Fujian Inst  of Res  an the Struct  of Matter, Fuzhou, China"
395,396,"Department of Informatics, University of Pretoria, Pretoria, South Africa  2  Electronics and Microelectronics, Dept  of Electrical, Electronic and Computer Engineering, University of Pretoria, Pretoria, South Africa  3  ECE Department, Drexel University, Philadelphia, PA 19104, United States  4  Center for Artificial Intelligence Research  CAIR , CSIR Meraka  5  SMCS, IEEE South Africa Section  6  IEEE Committee on Global Accreditation Activities  CGAA   7  Educational Activities Board  EAB"
396,397,"Dept  of Chem  Eng , Nat  Taiwan Univ  of Sci    Technol , Taipei, Taiwan"
397,398,"Department of Materials Science and Chemical Engineering, Shizuoka University, 3 5 1 Johoku, Hamamatsu, Shizuoka 432 8561, Japan  2  Toyota Motor Corporation Fuel Cell System Development Division, 1200 Mishuku, Susono, Shizuoka 410 1193, Japan"
398,399,"IT University of Copenhagen, Copenhagen, Denmark  2  NTNU, Trondheim, Norway  3  KTH, CSC, PDC, Sweden  4  SINTEF, Oslo, Norway  5  Technical University of Tampere, Finland  6  University of TarTu, Estonia"
399,400,"Dipartimento di Informatica, University of l Aquila, Italy  2  Department of Computer Engineering, Bilkent University, Ankara, Turkey"
400,401,"Excet Inc , Springfield, VA 22151, United States  2  Dynalene Inc , Whitehall, PA 18052, United States  3  US Naval Research Laboratory, Chemistry Division, 4555 Overlook Avenue, SW, Washington, DC 20375, United States"
401,402,"Toyota Central R and D Labs , Inc , 41 1, Yokomichi, Nagakute, Aichi, 480 1192, Japan"
402,403,"Fuel Cell System Development Div , Toyota Motor Corporation, 1200 Mishuku, Susono, Shizuoka 410 1193, Japan"
403,404,"Chemical and Biological Engineering and Clean Energy Research Centre, University of British Columbia, 2360 East Mall, Vancouver, BC, V6T 1Z3, Canada  2  National Research Council of Canada, 4250 Wesbrook Mall, Institute for Fuel Cell Innovation, Vancouver, BC, V6T 1W5, Canada  3  Ballard Power Systems, Inc , 9000 Glenlyon Parkway, Burnaby, BC, V5J 5J8, Canada"
404,405,"Department of Metallurgical and Materials Engineering, Colorado School of Mines, Golden, CO 80401, United States  2  National Renewable Energy Laboratory, Golden, CO 80401, United States  3  Department of Chemistry, Colorado School of Mines, Golden, CO 80401, United States"
405,406,"Department of Chemistry, Queen s University, Kingston, ON K7L 3N6, Canada"
406,407,"Department of Life Sciences, IMAR   Institute of Marine Research, University of Coimbra, 3004 517 Coimbra, Portugal  2  Institute of Oceanography, FCUL Campo Grande, 1749 016 Lisbon, Portugal  3  Institute for Natural Resource Conservation, Department of Ecosystem Management, Olshausenstr  75, D 24118 Kiel, Germany"
407,408,"University of Rochester, Department of Chemical Engineering, Gavett Hall 206, Rochester, NY 14627, United States  2  University of Illinois at Urbana Champaign, Department of Chemical and Biomolecular Engineering, 600 S  Mathews Ave, Urbana, IL 61801, United States"
408,409,"Department of Materials Science and Engineering, University of California, Los Angeles, CA 90095, United States  2  California NanoSystems Institute, University of California, Los Angeles, CA 90095, United States  3  China University of Petroleum, Beijing, China"
409,410,"Instituto de Carboqu mica, CSIC, Miguel Luesma Cast n 4, 50018, Zaragoza, Spain  2  Istituto di Tecnologie Avanzate per l Energia Nicola Giordano, CNR, Via Salita S  Lucia Sopra Contesse 5, Messina, Italy"
410,411,"Department of Chemistry, Chemical Engineering Division, Technical University Berlin, Berlin 10623, Germany"
411,412,"Department of Mechanical Engineering, Purdue School of Engineering and Technology, Indiana University Purdue University, Indianapolis, IN 46202, United States"
412,413,"Center for Electrochemical Science and Engineering, Department of Chemical and Biological Engineering, Illinois Institute of Technology, Chicago, IL 60616, United States"
413,414,"College of Environmental and Energy Engineering, Beijing University of Technology, Beijing 100124, China  2  College of Engineering, Peking University, Beijing 100871, China"
414,415,"Fuel Cell Nanomaterials Center, University of Yamanashi, Miyamae 6 43, Kofu 400 0021, Japan  2  Clean Energy Research Center, University of Yamanashi, Takeda 4, Kofu 400 8511, Japan"
415,416,"Renewable Energy Resources Lab  RERL , University of California, Irvine, Irvine, CA 92697 3975, United States  2  Texas AandM University, College Station, TX 77843, United States  3  Los Alamos National Laboratory  LANL , Los Alamos, NM 87545, United States"
416,417,"Dalian Institute of Chemical Physics, Chinese Academy of Sciences, Dalian, 116023, China  2  Dalian National Laboratory for Clean Energy, Dalian 116023, China  3  Graduate University, Chinese Academy of Sciences, Beijing 100039, China"
417,418,"Department of Mechanical Engineering, University of Botswana, P Bag 0061, Gaborone, Botswana"
418,419,"Division of Nanomaterials and Chemistry, Hefei National Laboratory for Physical Sciences at Microscale, Hefei 230026, China  2  Department of Chemistry, National Synchrotron Radiation Laboratory, University of Science and Technology of China, Hefei 230026, China"
419,420,"Department of Systems Engineering, University of Arkansas at Little Rock, Little Rock, AR 72204, United States  2  Chemical Sciences and Engineering Division, Argonne National Laboratory, Argonne, IL 60439 4837, United States  3  Department of Chemistry, University of Arkansas at Little Rock, Little Rock, AR 72204, United States  4  Department of Applied Science, University of Arkansas at Little Rock, Little Rock, AR 72204, United States"
420,421,"Centre for Pattern Analysis and Machine Intelligence, University of Waterloo, ON, Canada"
421,422,"Daimler AG, R and D MEA and Stack Technology, Kirchheim Nabern 73230, Germany  2  Ford Motor Company, Dearborn, MI 48124, United States"
422,423,"Energy Lab , Emerging Tech  Research Center, Samsung Advanced Institute of Technology, San  14 1, Nongseo dong, Giheung gu, Yongin, Gyeonggi do, 446 712, Korea, Republic of"
423,424,"Key Laboratory of Environmentally Friendly Chemistry and Applications, Ministry of Education, Xiangtan University, Xiangtan, Hunan 411105, China"
424,425,"Corporate Research and Development Center, Toshiba Corporation, Kawasaki city, 2128582, Japan"
425,426,"Institute for Materials and Surface Technology  IMST , University of Applied Sciences Kiel, Kiel 24149, Germany"
426,427,"Tokyo Institute of Technology, 2 12 1, O okayama, Meguro ku, Tokyo, 152 8552, Japan"
427,428,"Department of Systems Engineering, University of Arkansas at Little Rock, Little Rock, AR 72204, United States  2  Department of Chemistry, University of Arkansas at Little Rock, Little Rock, AR 72204, United States  3  Department of Applied Science, University of Arkansas at Little Rock, Little Rock, AR 72204, United States"
428,429,"Chemical and Biomolecular Engineering, National University of Singapore, 4 Engineering Drive 4, Singapore 117576, Singapore  2  NUS Graduate School for Integrative Sciences and Engineering  NGS , Centre for Life Sciences  CeLS , 05 01 28 Medical Drive, Singapore 117456, Singapore  3  Institute of Materials Research and Engineering, 3 Research Link, Singapore 117602, Singapore"
429,430,"School of Mechanical Engineering, Tongji University, 4800 Caoan Road, Shanghai 201804, China  2  School of Automotive Studies, Tongji University, 4800 Caoan Road, Shanghai 201804, China"
430,431,"Key Laboratory of Soft Chemistry and Functional Materials, Nanjing University of Science and Technology, Ministry of Education, Nanjing 210094, China"
431,432,"Department of Automotive Engineering, Clemson University, Clemson  SC, United States"
432,433,"Centro de Investigaci n en Ciencia Aplicada y Tecnolog a Avanzada, CICATA IPN Unidad Altamira, Carretera Tampico Puerto Industrial, C P  89600 Altamira, Tamaulipas, Mexico  2  Universidad Iberoamericana, Departamento de Ingenier a y Ciencias Qu micas, Prolongaci n Paseo de la Reforma 880, Lomas de Santa Fe M xico, C P  01219, Mexico  3  Laboratorio de Microscopia de Ultra Alta Resoluci n, Instituto Mexicano Del Petr leo, Eje Central L zaro C rdenas No  152, C P  07730, Mexico  4  CNRS, LCC  Laboratorie de Chimie de Coordination , 205 Route de Narbonne, F 31077 Toulouse, France  5  Universit  Toulouse, UPS, LCC, F 31077 Toulouse, France"
433,434,"Dept  of Chem , Tongji Univ , Shanghai, China"
434,435,"Department of Systems Engineering, University of Arkansas at Little Rock, Little Rock, AR 72204, United States  2  Department of Chemistry, University of Arkansas at Little Rock, Little Rock, AR 72204, United States  3  Department of Applied Science, University of Arkansas at Little Rock, Little Rock, AR 72204, United States  4  Chemical Sciences and Engineering Division, Argonne National Laboratory, Argonne, IL 60439 4837, United States"
435,436,"Department of Software Systems, Tampere University of Technology, Tampere, Finland"
436,437,"Department of Distributed and Dependable Systems, Faculty of Mathematics and Physics, Charles University, Prague, Czech Republic  2  Institute of Computer Science, Academy of Sciences of the Czech Republic, Prague, Czech Republic"
437,438,"NICTA, Level 5, 13 Garden St, Eveleigh NSW 2015, Australia School of Computer Science and Engineering, University of NSW, NSW 2052, Australia"
438,439,"Fraunhofer Institute for Experimental Software Engineering, 67663 Kaiserslautern, Germany  2  John Deere European Technology Innovation Center, Division of Deere and Company, Kaiserslautern, Germany"
439,440,"University of Erlangen Nuremberg, Martensstr  3, 91058 Erlangen, Germany  2  QAware GmbH, Aschauer Str  32, 81549 Munich, Germany"
440,441,"Johannes Kepler University Linz, Linz, Austria  2  Software Competence Center Hagenberg, Hagenberg, Austria  3  GRZ IT Center Linz GmbH, Linz, Austria"
441,442,"School of Computing and Communications, Lancaster University, Lancaster, LA1 4WA, United Kingdom"
442,443,"Dept  Math  Info , Universit  Toulouse 2, Toulouse, France  2  LGI2P Ecole des Mines d Al s, N mes, France  3  Research Center of Automation, Northeastern University, Shenyang, China  4  LIRMM, UMR 5506, Univ  Montpellier 2, Montpellier, France"
443,444,"Dipartimento di Informatica, Universit  dell Aquila, Italy"
444,445,"Industrial Software Systems Program, ABB Corporate Research, Ladenburg, Germany  2  ABB Power Generation, Genova, Italy"
445,446,"Institute for Software Research, University of California, Irvine, Irvine, CA, United States"
446,447,"Computer Science Department, University of Southern California, Los Angeles, CA 90089, United States  2  Yahoo Labs , United States"
447,448,"Institute of Control and Computation Engineering, Warsaw Univeristy of Technology, Warsaw, Poland"
448,449,"Software Engineering Institute, Carnegie Mellon University, Pittsburgh, PA, United States  2  Electrical and Computer Engineering, University of British Columbia, Vancouver, BC, Canada"
449,450,"School of Computer Science, University of Birmingham, Edgbaston, Birmingham B15 2TT, United Kingdom"
450,451,"Christian Doppler Lab  for Automated Software Engineering, Johannes Kepler Universit t, Austria  2  Siemens VAI Metals Technologies, Turmstrae 44, Linz, Austria  3  Systems Engineering and Automation, Johannes Kepler Universit t, Linz, Austria"
451,452,"National ICT, Sydney, NSW, Australia  2  Software Engineering Institute, Carnegie Mellon University, Pittsburgh, PA, United States"
452,453,"Software Engineering Division, Dept  of Computer Science and Engineering, Chalmers University of Technology, G teborg, Sweden"
453,454,"VU University, Netherlands  2  Swinburne University of Technology, Australia  3  Wuhan University, China"
454,455,"University of Groningen, Netherlands"
455,456,"Computing Systems Department, University of Castilla La Mancha, Albacete, Spain  2  Eurocopter Espa a, EADS Group, Albacete, Spain"
456,457,"IBBT DistriNet, KU Leuven, Belgium"
457,458,"Christian Doppler Laboratory for Automated Software Engineering, Johannes Kepler University, Linz, Austria"
458,459,"FZI Research Center for Information Technology, Karlsruhe, Germany  2  1 and 1 Internet AG, Mail and Media Development, Karlsruhe, Germany  3  Karlsruhe Institute of Technology, Karlsruhe, Germany"
459,460,"Computer Engineering Department, Istanbul Technical University, Istanbul, Turkey  2  TUBITAK BILGEM, Information Technologies Institute, Kocaeli, Turkey  3  Computer Engineering Department, Ozyegin University, Istanbul, Turkey"
460,461,"Johannes Kepler University  JKU , Linz, Austria"
461,462,"Fraunhofer Institute for Experimental Software Engineering  IESE , Kaiserslautern, Germany"
462,463,"University of Southern California, United States  2  University of Massachusetts, United States"
463,464,"Drexel University, Philadelphia, PA, United States"
464,465,"University of S o Paulo, S o Carlos, SP, Brazil  2  University of South Brittany, Vannes, France  3  Fraunhofer IESE, Kaiserslautern, Germany"
465,466,"SAP Research, Chemnitzer Strae 48, Dresden, Germany  2  TU Dresden, N thnitzer Strae 46, Dresden, Germany"
466,467,"IBBT DistriNet  KULeuven , Celestijnenlaan 200A, B 3001, Belgium"
467,468,"Computer Science, Aarhus University, Aarhus, Denmark  2  Computer Science  DIKU , University of Copenhagen, Copenhagen, Denmark"
468,469,"University of Coimbra, Portugal"
469,470,"Logica, Amstelveen, Netherlands  2  Logica, London, United Kingdom  3  Eindhoven University of Technology, Netherlands  4  VU University, Amsterdam, Netherlands"
470,471,"Department of Computer Science, University of Auckland, Auckland, New Zealand  2  College of Engineering and Computer Science, Australian National University, Canberra, ACT, Australia  3  Faculty of Information and Communication Technologies, Swinburne University of Technology, VIC, Australia"
471,472,"LIRMM, University of Monpellier 2, France  2  MGPS, Port Saint Louis, France  3  MISC, University of Constantine, Algeria"
472,473,"Faculty of Computer Science, University of Vienna, Austria  2  Institute for IS and New Media, WU Vienna, Austria"
473,474,"Computer Science Department, VU University Amsterdam, Netherlands"
474,475,"Computational Sciences and Engineering Division, Oak Ridge National Laboratory, Oak Ridge, TN, United States"
475,476,"Johannes Kepler University Linz, Linz, Austria"
476,477,"Carnegie Mellon University, Software Engineering Institute, Pittsburgh, PA, United States  2  Carnegie Mellon University, School of Computer Science, Pittsburgh, PA, United States"
477,478,"QCIS, University of Technology, Syndey, NSW, Australia  2  Dept  of Computer Sci  and Tech , Tsinghua University, China"
478,479,"Universit  degli Studi dell Aquila, Italy"
479,480,"IRISA, Universit  de Bretagne Sud, Vannes, France"
480,481,"University of Groningen, Fontys University of Applied Sciences, Venlo, Netherlands  2  University of Groningen, Groningen, Netherlands"
481,482,"Artechra, Hemel Hempstead, Hertfordshire, United Kingdom  2  University of East London, London, United Kingdom"
482,483,"Greenplum, United States"
483,484,"Nokia Corporation, Espoo, Finland"
484,485,"FZI Research Center for Information Technologies, Software Engineering, Haid und Neu Str  10 14, 76131 Karlsruhe, Germany"
485,486,"ABB US Corporate Research Center, 940 Main Campus Drive, Raleigh, NC 27606, United States"
486,487,"ReDCAD, University of Sfax, B P  1173, 3038 Sfax, Tunisia  2  CNRS, LAAS, 7 Avenue du colonel Roche, F 31400 Toulouse, France  3  Univ  de Toulouse, LAAS, F 31400 Toulouse, France"
487,488,"University of Lyon, INSA Lyon, CITI INRIA, F 69621, Villeurbanne, France"
488,489,"GESSI Research Group, Universitat Polit cnica de Catalunya, Barcelona, Spain  2  Everis, Barcelona, Spain"
489,490,"University of Bayreuth, Universit tsstr  30, 95440 Bayreuth, Germany"
490,491,"Kybele Research Group, University Rey Juan Carlos, Madrid, Spain  2  Institute of Architecture of Application Systems, University of Stuttgart, Germany"
491,492,"Universidad de Los Andes, Bogot  D C , Colombia"
492,493,"Fraunhofer Institut FOKUS, Kaiserin Augusta Alle 31, 10589 Berlin, Germany"
493,494,"Department of Computer Science and Mathematics, University of L Aquila, L Aquila, Italy  2  Department of Computer Science, University of York, York, United Kingdom  3  Develop Group Basys GmbH, Erlangen, Germany"
494,495,"Universidad de Los Andes, Department of Systems and Computing Engineering, Bogot , Colombia"
495,496,"Portland State University, United States"
496,497,"Carnegie Mellon University, United States"
497,498,"Aarhus University, Denmark"
498,499,"University of Magdeburg, Germany  2  University of Passau, Germany  3  University of Augsburg, Germany"
499,500,"Department of Space, Govt  of India, Atmosphere and Ocean Sciences Group, Earth and Climate Science Area  ECSA , National Remote Sensing Center, Balanagar, Hyderabad, 500 037, India"
500,501,"Department of Materials Chemistry and Engineering, Konkuk University, Neungdong ro 126, Seoul 143 701, Korea, Republic of"
501,502,"ISTEC CNR, Institute of Science and Technology for Ceramics, National Research Council, Via Granarolo 64, 48018 Faenza, Italy  2  Department of Industrial Chemistry and Materials, Bologna University, Viale del Risorgimento 4, 40136 Bologna, Italy"
502,503,"Department of Materials Science and Chemical Engineering, Shizuoka University, 3 5 1 Johoku, Naka ku, Hamamatsu 432 8561, Japan  2  Toyota Motor Corporation Fuel Cell System Development Division, 1200 Mishuku, Susono, Shizuoka 410 1194, Japan"
503,504,"National Physical Laboratory, Teddington Middlesex TW11 0LW, United Kingdom  2  Johnson Matthey Fuel Cells, Lydiard Fields, Great Western Way, Swindon, Wiltshire SN5 8AT, United Kingdom"
504,505,"School of Electronic Engineering, Huaihai Institute of Technology, Lianyungang Jiangsu 222005, China  2  Institute of Internet of Things Engineering, Jiangnan University, Wuxi Jiangsu 214122, China"
505,506,"National Physical Laboratory, Teddington, Middlesex, United Kingdom  2  Johnson Matthey Fuel Cells, Lydiard Fields, Great Western Way, Swindon, Wiltshire, United Kingdom"
506,507,"Electrochemistry Laboratory, Paul Scherrer Institut, 5232 Villigen PSI, Switzerland"
507,508,"Faculty of Science, University of Ontario Institute of Technology, 2000 Simcoe Street North, Oshawa, ON L1H 7K4, Canada"
508,509,"State Key Laboratory of Information Photonics and Optical Communications, Beijing University of Posts and Telecommunications, Beijing 100876, China  2  School of Science, Beijing University of Posts and Telecommunications, Beijing 100876, China  3  Beijing National Laboratory for Condensed Matter Physics, Institute of Physics, Chinese Academy of Sciences, Beijing 100190, China  4  School of Electronic Engineering, Beijing University of Posts and Telecommunications, Beijing 100876, China"
509,510,"Electrochemical Innovation Lab , University College London, London WC1E 7JE, United Kingdom  2  Department of Chemistry, University College London, London WC1H 0AJ, United Kingdom"
510,511,"State Key Laboratory of Electroanalytical Chemistry, Changchun Institute of Applied Chemistry, Chinese Academy of Sciences, Changchun 130022, Jilin, China  2  Graduate School of the Chinese Academy of Sciences, Beijing 100039, China"
511,512,"School of Electronic Engineering, Huaihai Institute of Technology, Jiangsu Province, 222005, China  2  Gippsland School of Information Technology, Monash University, Northways Road, Churchill, VIC 3842, Australia"
512,513,"Nano Science Center, Department of Chemistry, University of Copenhagen, Universitetsparken 5, DK 2100 Copenhagen  , Denmark  2  Niels Bohr Institute, University of Copenhagen, Universitetsparken 5, DK 2100 Copenhagen  , Denmark"
513,514,"New Energy Device Research Laboratory, KRI, Inc , 6 19 9 Torishima, Konohana ku, Osaka City, Osaka 554 0051, Japan"
514,515,"State Key Laboratory of Optoelectronic Materials and Technologies, Sun Yat sen University, Guangzhou 510275, China"
515,516,"Department of Chemical Engineering, National Taiwan University of Science and Technology,  43, Sec  4, Keelung Rd , Taipei, 10607, Taiwan  2  Department of Chemical Engineering, Institut Teknologi Sepuluh Nopember, Surabaya 60111, Indonesia  3  National Synchrotron Radiation Research Center, 101 Hsin Ann Road, Hsinchu Science Park, Hsinchu 30076, Taiwan"
516,517,"University of South Carolina, Center for Electrochemical Engineering, Dept  of Chemical Engineering, Columbia, SC 29208, United States  2  University of Massachusetts Amherst, Dept  of Chemical Engineering, Amherst, MA 01003, United States"
517,518,"Technische Chemie i, Institut f r Chemie, Martin Luther Universit t Halle Wittenberg, von Danckelmann Platz 4, 06120 Halle, Germany"
518,519,"Department of College of Environmental and Energy Engineering, Beijing University of Technology, 100124 Beijing, China  2  National Engineering Laboratory for Advanced Coatings Technology of Metal Material, China Iron and Steel Research Institute Group, 100081 Beijing, China"
519,520,"Department of Materials Chemistry and Engineering, College of Engineering, Konkuk University, 120 Neungdong ro, Gwang Jin Gu, Seoul 143 701, Korea, Republic of  2  Department of Chemical Engineering, Hanyang University, Seoul 133 791, Korea, Republic of"
520,521,"Fuel Cell Nanomaterials Center, University of Yamanashi, 6 43 Miyamae, Kofu 400 0021, Japan  2  Clean Energy Research Center, University of Yamanashi, 4 Takeda, Kofu 400 8511, Japan"
521,522,"Dept  of R D, China Center of Resources Satellite Data   Applic , Beijing, China"
522,523,"State Key Laboratory of Metal Matrix Composites, Shanghai Jiao Tong University, Shanghai 200240, China  2  Department of Mechanical and Manufacturing Engineering, University of Calgary, 2500 University Drive NW, Calgary, AB T2N 1N4, Canada"
523,524,"LEMTA, Universit  de Lorraine, Vandoeuvre l s Nancy, France  2  LEMTA, CNRS, Vandoeuvre l s Nancy, France  3  Los Alamos National Laboratory, Los Alamos, NM, United States"
524,525,"Chemistry Department, Middle East Technical University, 06531 Ankara, Turkey  2  Biochemistry Department, Dumlupinar University, 43020 Kutahya, Turkey"
525,526,"Green Energy Research Institute, Department of Nanotechnology and Advanced Materials Engineering, Sejong University, Seoul 143 747, Korea, Republic of  2  Korea Institute of Rare Metals, Korea Institute of Industrial Technology, Incheon 404 254, Korea, Republic of  3  School of Nano Bioscience and Chemical Engineering, Ulsan National Institute of Science and Technology  UNIST , Ulsan 689 798, Korea, Republic of  4  Department of Energy and Mineral Resources Engineering, Sejong University, Seoul 143 747, Korea, Republic of"
526,527,"State Key Laboratory of Applied Organic Chemistry, College of Chemistry and Chemical Engineering, Lanzhou University, Lanzhou 730000, China"
527,528,"Department of Applied Chemistry, Graduate School of Engineering, Kyushu University, 744 Motooka, Nishi ku, Fukuoka 819 0395, Japan  2  International Institute for Carbon Neutral Energy Research  WPI I2CNER , Kyushu University, 744 Motooka, Nishi ku, Fukuoka, Japan  3  JST CREST, 5 Sanbancho, Chiyoda ku, Tokyo, Japan"
528,529,"CNR ITAE Istituto di Tecnologie Avanzate per l Energia Nicola Giordano, Via Salita S  Lucia sopra Contesse 5, 98126 Messina, Italy"
