,affilID,affiliation
529,530,"State Key Laboratory of Metal Matrix Composites, Shanghai Jiao Tong University, Shanghai 200240, China  2  Department of Chemistry, Texas AandM University Kingsville, MSC 161, Kingsville, TX 78363 8012, United States  3  Advanced Light Source, ALS Lawrence Berkeley National Laboratory, Berkeley, CA 94720, United States"
530,531,"Lancaster University, United Kingdom  2  IT University of Copenhagen, Copenhagen, Denmark"
531,532,"Chemistry Department, Southern Federal University, Zorge st , 7, Rostov on Don 344090, Russia  2  University of Science and Technology MISIS, Leninskiy pr  4, Moscow 119049, Russia"
532,533,"Department of Materials Science and Engineering, National Chung Hsing University, 250 Kuo Kuang Road, Taichung 40227, Taiwan"
533,534,"Department of Chemistry, University of Copenhagen, DK 2100 Copenhagen, Denmark  2  Institute of Applied and Physical Chemistry, University of Bremen, Bremen D 28334, Germany"
534,535,"Key Laboratory for the Chemistry and Molecular Engineering of Medicinal Resources, College of Chemistry and Chemical Engineering, Guangxi Normal University, Guilin 541004, China  2  Beijing National Laboratory for Molecular Sciences, College of Chemistry and Molecular Engineering, Peking University, Beijing 100871, China"
535,536,"Department of Materials Science and Engineering, National Chung Hsing University, 250, Kuo Kuang Road, Taichung 40227, Taiwan"
536,537,"Center for Electrochemical Science and Engineering, Department of Chemical and Biological Engineering, Illinois Institute of Technology, 10 W 33rd Street, 127 Perlstein Hall, Chicago, IL 60616, United States"
537,538,"Key Laboratory of Applied Chemistry, Yanshan University, Qinhuangdao, Hebei 066004, China"
538,539,"Dept  of Chemical Engineering, Graduate School of Engineering, Hiroshima University, 1 4 1 Kagamiyama, Higashi Hiroshima, Hiroshima, 739 8527, Japan  2  Kanomax Japan, Inc , 2 1 Shimizu Suita City, Osaka, 565 0805, Japan  3  Dept  of Chemical Engineering, Faculty of Industrial Technology, Sepuluh Nopember Institute of Technology, Kampus ITS Sukolilo, Surabaya, East Java, 60111, Indonesia"
539,540,"Key Laboratory for the Chemistry and Molecular Engineering of Medicinal Resources, College of Chemistry and Chemical Engineering, Guangxi Normal University, Guilin, China  2  Beijing National Laboratory for Molecular Sciences, College of Chemistry and Molecular Engineering, Peking University, Beijing, China"
540,541,"Escuela Superior de Ingenier a Qu mica e Industrias Extractivas, Laboratorio de Electroqu mica y Corrosi n, ESIQIE IPN, Mexico, D F , Mexico  2  Departamento de Ingenier a Metal rgica, Escuela Superior de Ingenier a Qu mica e Industrias Extractivas, ESIQIE IPN, Mexico, D F , Mexico"
541,542,"Chemical Engineering, TU Delft, Julianalaan 136, BL Delft, Netherlands"
542,543,"Department of Physics, Nano Functional Materials Technology Centre  NFMTC , Indian Institute of Technology Madras, Chennai 600036, India  2  Centre for Fuel Cell Technology, ARCI, 2nd Floor, IITM Research Park, Taramani, Chennai 600 113, India"
543,544,"Department of Chemistry and Nano Science Center, University of Copenhagen, Universitetsparken 5, Copenhagen DK 2100, Denmark  2  Sino Danish Centre for Education and Research  SDC , Niels Jensens Vej 2, Aarhus DK 8000, Denmark"
544,545,"Department of Engineering Technology, Texas Center for Superconductivity, University of Houston, Houston, TX 77204, United States  2  Unit 1J, 1500 Harbour Dr, Wheeling, IL 60090, United States  3  Chemical Sciences and Engineering Division, Argonne National Laboratory, 9700S Cass Avenue, Argonne, IL 60439, United States"
545,546,"Department of Mining, Energy and Geological Engineering, Botswana International University of Science and Technology, P Bag BO 041 Bontleng, Gaborone, Botswana  2  CELS   Research Center on Logistics and after Sales Service, University of Bergamo, Italy  3  Department of Mechanical Engineering, University of Botswana, P Bag UB0061, Gaborone, Botswana  4  Institute of Building Engineering, Warsaw University of Technology, Warsaw, Poland"
546,547,"Department of Chemical and Biomolecular Engineering, University of Connecticut, Storrs, CT 06269, United States  2  Department of Materials Science and Engineering, University of Connecticut, Storrs, CT 06269, United States"
547,548,"Department of Chemistry, Cornell University, Ithaca, NY 14853 1301, United States"
548,549,"Department of Physics, Portland State University, Portland, OR 97201, United States  2  Department of Materials Science and Engineering, College of Engineering, Peking University, Beijing 100871, China  3  Department of Chemistry, Portland State University, Portland, OR 97201, United States"
549,550,"Key Lab  of Soft Chem    Functional Mater , Nanjing Univ  of Sci    Technol , Nanjing, China"
550,551,"Faculty of Engineering, Department of Hydrogen Energy Systems, Kyushu University, Japan  2  International Research Center for Hydrogen Energy, Kyushu University, Japan  3  Next Generation Fuel Cell Research Center  NEXT FC , Kyushu University, Japan  4  International Inst  for Carbon Neutral Energy Research  WPI I2CNER , Kyushu University, Japan"
551,552,"Department of Energy Conversion and Storage, Technical University of Denmark, Kemitorvet 207, DK 2800 Lyngby, Denmark  2  Laboratory of Advanced Power Sources, Changchun Institute of Applied Chemistry, Chinese Academy of Sciences, Changchun 130022, China  3  Department of Physical Chemistry, University of Science and Technology Beijing, 30 College Road, Beijing 100083, China"
552,553,"Key Laboratory for the Chemistry and Molecular Engineering of Medicinal Resources, Ministry of Education of China, Guangxi Normal University, Guilin 541004, China"
553,554,"State Key Laboratory of Metal Matrix Composites, Shanghai Jiao Tong University, Shanghai 200240, China  2  Department of Chemistry, Texas A and M University Kingsville, MSC 161, Kingsville, TX 78363 8012, United States  3  Advanced Light Source, ALS Lawrence Berkeley National Laboratory, Berkeley, CA 94720, United States"
554,555,"Clean Energy Automotive Eng  Center, Tongji Univ , Shanghai, China"
555,556,"Department of Mechanical and Materials Engineering, University of Western Ontario, London, ON N6A 5B9, Canada  2  General Motors RandD Center, Warren, MI 48090 9055, United States  3  Department of Chemistry, University of Western Ontario, London, ON N6A 5B7, Canada"
556,557,"Department of Chemistry, Queen s University, 90 Bader Lane, Kingston, ON K7L 3N6, Canada  2  Department of Chemistry and 4D LABORATORIES, Simon Fraser University, 8888 University Drive, Burnaby, BC V5A 1S6, Canada  3  FEI Company, NanoPort, Bldg, Achtseweg Noord 5, 5651 GG, Eindhoven, Netherlands"
557,558,"Fuel Cell System and Engineering Group, Dalian Institute of Chemical Physics, Chinese Academy of Sciences, 457 Zhongshan Road, Dalian, China  2  Graduate School of Chinese Academy of Sciences, 19A Yuquan Road, Beijing, China"
558,559,"Key Laboratory of Functional Inorganic Material Chemistry, Ministry of Education of the People s Republic of China, Heilongjiang University, Harbin 150080, China"
559,560,"Instituto de Carboqu mica, CSIC, Miguel Luesma Cast n 4, 50018, Zaragoza, Spain  2  Universidad de La Laguna, Dpto de Qu mica F sica, Avda  Astrof sico Francisco S nchez s n, 38071 La Laguna, Tenerife, Spain"
560,561,"LAAS CNRS, Univ  de Toulouse, 31031 Toulouse, France  2  IRISA, University of South Brittany, France  3  LIRMM, Montpellier, France"
561,562,"Departamento de Lenguajes Y Ciencias de la Computaci n, University of M laga, M laga, Spain  2  CAOSD Group, Spain"
562,563,"Faculty of Informatics, University of Lugano, Switzerland"
563,564,"VorTIC3 Research Group, Dept  of Comp  Languages and Systems II, Rey Juan Carlos University, Madrid, Spain  2  DataWeb Research, Dept  of Computer Science, University of Valladolid, Segovia, Spain  3  DataWeb Research, Dept  of Computer Science, University of Valladolid, Valladolid, Spain  4  Dept  of Computer Science, University of Chile, Santiago, Chile"
564,565,"Femto ST Institute, University of Franche Comt , Besan on, France"
565,566,"Research Group Software Architecture, University of Vienna, Austria"
566,567,"DIMAp   Department of Informatics and Applied Mathematics, UFRN   Federal University of Rio Grande Do Norte, Natal, Brazil"
567,568,"Clausthal University of Technology, Department of Informatics, Julius Albert Strasse 4, 38678 Clausthal Zellerfeld, Germany"
568,569,"Software Engineering Team, Fontys University of Applied Sciences, Eindhoven, Netherlands  2  Information Systems Group, School of Industrial Engineering, Eindhoven University of Technology, Eindhoven, Netherlands  3  Management Science Faculty, Open University, Heerlen, Netherlands"
569,570,"AOSTE Team, UNS I3S INRIA, Sophia Antipolis, France  2  Formal Modeling and Analysis Group, M lardalen University, V ster s, Sweden"
570,571,"ETH Zurich, Switzerland  2  George Mason University, United States"
571,572,"Universitat Polit cnica de Catalunya  UPC , Barcelona, Spain  2  University of Canterbury, Christchurch, New Zealand  3  University of Groningen, Netherlands"
572,573,"Department of Software Technologies and Information Systems, University of Constantine II, Constantine, Algeria"
573,574,"CNRS, LAAS, 7 Avenue du Colonel Roche, F 31400 Toulouse, France  2  Univ  de Toulouse, LAAS, F 31400 Toulouse, France  3  ReDCAD, University of Sfax, B P  1173, 3038 Sfax, Tunisia"
574,575,"Norwegian University of Science and Technology, Trondheim, Norway"
575,576,"Department of Computer Science, Aarhus University, Aarhus, Denmark  2  Department of Computer Science  DIKU , University of Copenhagen, Copenhagen, Denmark"
576,577,"ReDCAD Research Unit, University of Sfax, Sfax, Tunisia"
577,578,"Universit  de Bretagne Sud, IRISA, Vannes, France"
578,579,"University of Groningen, Netherlands  2  University of Canterbury, New Zealand"
579,580,"University of Groningen, Groningen, Netherlands  2  Chalmers University of Technology, Gothenborg, Sweden"
580,581,"Department of Computer Science, Linnaeus University, Vaxjo, Sweden"
581,582,"BMW Forschung und Technik GmbH, M nchen, Germany  2  Technische Universit t M nchen, Lehrstuhl f r Betriebssysteme, Garching bei M nchen, Germany"
582,583,"School of Computer Science, University of St  Andrews, St Andrews KY16 9SX, United Kingdom"
583,584,"Johannes Kepler University, Linz, Austria"
584,585,"Fraunhofer Institute for Experimental Software Engineering, Kaiserslautern, Germany  2  Fraunhofer Project Center on Software and Systems Engineering, Department of Computer Science, Federal University of Bahia, Bahia, Brazil"
585,586,"Paluno   The Ruhr Institute for Software Technology, University of Duisburg Essen, Gerlingstr  16, 45127 Essen, Germany"
586,587,"Faculty of Computer Science, Software Architecture Group, University of Vienna, Austria"
587,588,"UFRN   Federal University of Rio Grande Do Norte, Natal, Brazil  2  IRISA, University of South Brittany, Vannes, France"
588,589,"Software Competence Center, Hagenberg, Austria  2  Johannes Kepler University, Linz, Austria"
589,590,"Federal Institute of Education, Science and Technology of Bahia, Salvador, BA 40110, Brazil  2  Strategic Software Engineering Research Group, Clemson University, Clemson, SC 29634, United States  3  Federal University of Bahia, Fraunhofer Project Center for Software and Systems Engineering, Salvador, BA 40170, Brazil  4  Federal University of Bahia, Salvador, BA 40170, Brazil"
590,591,"University of Kaiserslautern, 67663 Kaiserslautern, Germany  2  Fraunhofer IESE, Fraunhofer Platz 1, 67663 Kaiserslautern, Germany"
591,592,"DIMAp, Federal University of Rio Grande Do Norte, Natal, Brazil  2  IRISA UMR CNRS, Universit  de Bretagne Sud, Vannes, France  3  DCC PPGI, Universidade Federal Do Rio de Janeiro, Rio de Janeiro, Brazil"
592,593,"Atmosphere and Climate Sciences Group  ACSG , Earth and Climate Science Area  ECSA , National Remote Sensing Centre  NRSC , Hyderabad, India"
593,594,"University of Bern, Switzerland"
594,595,"Software Engineering Group, Kiel University, 24098 Kiel, Germany"
595,596,"Competence Center for IT Security, University of Applied Sciences Campus Vienna, Vienna, Austria  2  University of Applied Sciences Campus Vienna, Vienna, Austria"
596,597,"Federal Institute of Education, Science and Technology of Bahia, Salvador, BA 40110, Brazil  2  Federal University of Bahia, Fraunhofer Project Center for Software and Systems Engineering, Reuse in Software Engineering  RiSE  Labs , Salvador, BA 40170, Brazil  3  Strategic Software Engineering Research Group, Clemson University, Clemson, SC 29634, United States  4  Federal University of Bahia, Salvador, BA 40170, Brazil"
597,598,"VTT Technical Research Centre of Finland, Vuorimiehentie 3, 02044 VTT, Finland"
598,599,"Department of Computer Science  DIKU , University of Copenhagen, Denmark  2  Department of Computer Science, Aarhus University, Alexandra Institute, Denmark"
599,600,"Strategic Software Engineering Research Group, Clemson University, Clemson, SC 29634, United States"
600,601,"AdaptWise Research Group, Linnaeus University, Sweden"
601,602,"National Institute for Laser, Plasma and Radiation Physics, 409 Atomistilor St, RO 077125 Magurele, Romania"
602,603,"Chem  Eng  Dept , Jadavpur Univ , Kolkata, India  2  Chem  Eng  Dept , Univ  Teknol  Petronas, Tronoh, Malaysia  3  Dept  of Phys , Bengal Eng    Sci  Univ , Shibpur, India"
603,604,"Fac  of Electr    Electron  Eng , Univ  Tun Hussein Onn Malaysia  UTHM , Parit Raja, Malaysia  2  PETRONAS Penapisan  Melaka  Sdn  Bhd , Sungai Udang, Malaysia"
604,605,"Dept  of Electr  Eng , Indian Inst  of Technol , Patna, Patna, India"
605,606,"Dept  of Electr    Inf  Eng , Toyohashi Univ  of Technol , Toyohashi, Japan  2  Head Office for  Tailor Made   Baton Zone  Grad  Course, Toyohashi Univ  of Technol , Toyohashi, Japan  3  Res  Center for Agrotechnol    Biotechnol , Univ  of Technol , Toyohashi, Japan"
606,607,"University of South Africa  UNISA , South Africa"
607,608,"Group Technology Division, Eskom Enterprises Park, Cnr Simba and Leeuwkop Road, Sunninghill, Johannesburg, South Africa"
608,609,"Institute for Information Systems and New Media, WU Vienna, Austria"
609,610,"Department of Electrical Engineering, Indian Institute of Technology, Patna, Bihar 800013, India"
610,611,"Department of Electrical Engineering, Indian Institute of Technology, Patna, Bihar, India"
611,612,"Norwegian Univ  of Sci    Technol , Trondheim, Norway  2  Univ  of Appl  Sci  of Eastern Switzerland, Rapperswil, Switzerland"
612,613,"Fac  of Math    Phys , Charles Univ  in Prague, Prague, Czech Republic"
613,614,"Univ  Hamburg, Hamburg, Germany  2  Tech  Univ  Ilmenau, Ilmenau, Germany"
614,615,"ATSI S A   Adv  Technol  Syst  Int  , Zabierzo w, Poland  2  Dept  of Appl  Comput  Sci , AGH Univ  of Sci    Technol , Krako w, Poland"
615,616,"Univ  Hamburg, Hamburg, Germany"
616,617,"Software Composition Group, Univ  of Bern, Bern, Switzerland"
617,618,"Databases   Distrib  Syst , Tech  Univ  Darmstadt, Darmstadt, Germany"
618,619,"Software Eng , Fontys Univ  of Appl  Sci , Eindhoven, Netherlands"
619,620,"Dept  of Inf  Eng , Comput  Sci    Math , Univ  of L Aquila, L Aquila, Italy"
620,621,"DIMAp, Fed  Univ  of Rio Grande do Norte, Natal, Brazil  2  IRISA, Univ  de Bretagne Sud, Vannes, France"
621,622,"Databases   Distrib  Syst  Group  DVS , Tech  Univ  Darmstadt, Darmstadt, Germany"
622,623,"Lero The Irish Software Eng  Res  Centre, Univ  of Limerick, Limerick, Ireland  2  Dept  of Inf , Clausthal Univ  of Technol , Clausthal Zellerfeld, Germany"
623,624,"Dept  of Comput  Eng , Bilkent Univ , Ankara, Turkey"
624,625,"Dipt  di Ing  Elettr  e Dell Inf , Politec  di Bari, Bari, Italy"
625,626,"Amrita Sch  of Bus , Amrita Vishwa Vidyapeetham, Coimbatore, India  2  Dept  of Eng , Comput  Sci ,   Math , Univ  of L Aquila, L Aquila, Italy"
626,627,"Univ  of Kaiserslautern, Kaiserslautern, Germany"
627,628,"Andalucia Tech, Univ  de Malaga, Ma laga, Spain"
628,629,"IC4 The Irish Centre for Cloud Comput    Commerce, Dublin City Univ , Dublin, Ireland  2  Microsoft Ireland, Dublin, Ireland"
629,630,"Open Univ , Milton Keynes, United Kingdom  2  Inria Paris Rocquencourt, Alpines, France"
630,631,"RACON Software GmbH, Austria  2  Software Competence Center Hagenberg, Austria  3  Johannes Kepler Univ  Linz, Linz, Austria"
631,632,"Vestel Electron , Manisa, Turkey  2  Dept  of Comput  Sci , Ozyegin Univ , Istanbul, Turkey"
632,633,"DGIGL, Ecole Polytech  de Montreal, Montreal, QC, Canada  2  Dept  d Inf , Univ  du Quebec a Montreal, Montreal, QC, Canada"
633,634,"Project Group Mechatron  Syst  Design, Fraunhofer IPT, Paderborn, Germany  2  Univ  Nice Sophia Antipolis, Sophia Antipolis, France"
634,635,"IRISA, Univ  de Bretagne Sud, Vannes, France  2  DIRO, Univ  de Montreal, Montre al, QC, Canada"
635,636,"Carnegie Mellon Software Eng  Inst , United States  2  VU Univ  Amsterdam, Amsterdam, Netherlands"
636,637,"Dept  of Comput  Syst , Univ  of Sao Paulo   USP, Sa o Carlos, Brazil  2  IRISA Res  Inst , Univ  of South Brittany, Vannes, France"
637,638,"Dept  of Inf    Comput  Sci , Utrecht Univ , Utrecht, Netherlands"
638,639,"Johannes Kepler Univ  Linz, Linz, Austria"
639,640,"Software Eng  Group, Univ  of Paderborn, Paderborn, Germany"
640,641,"State Key Lab  of Software Eng , Wuhan Univ , Wuhan, China"
641,642,"Fed  Univ  of Paraiba, Joa o Pessoa, Brazil  2  Fed  Univ  of Rio Grande do Norte, Natal, Brazil  3  Univ  of Sao Paulo, Sa o Carlos, Brazil"
642,643,"Smart Res  Dev  Centre, CAS Software AG, Karlsruhe, Germany  2  IT Innovation, Univ  of Southampton, Southampton, United Kingdom  3  Sch  of Comput    Commun , Lancaster Univ , Lancaster, United Kingdom"
643,644,"CDL Flex, Inst  of Software Technol    Interactive Syst , Vienna Univ  of Technol , Vienna, Austria"
644,645,"University of Kaiserslautern, Gottlieb Daimler Strae 47, 67663 Kaiserslautern, Germany"
645,646,"Amrita School of Business, Amrita Vishwa Vidyapeetham, India  2  Center for Research in Advanced Technologies for Education  CREATE , Amrita Vishwa Vidyapeetham, India  3  Department of Engineering, Computer Science, and Mathematics, University of l Aquila, Italy"
646,647,"IC4   the Irish Centre for Cloud Computing and Commerce, Dublin City University, Dublin 9, Ireland  2  Microsoft Ireland, Dublin 18, Ireland"
647,648,"Software Engineering, Fontys University of Applied Sciences, Netherlands  2  Consulting Software Systems Architect, United States"
648,649,"Department of Applied Computer Science, AGH University of Science and Technology, al  Mickiewicza 30, 30 059 Krak w, Poland  2  ATSI S A   Advanced Technology Systems International , ul  Krakowska 386, 30 080 Zabierz w, Poland"
649,650,"Smart Research Development Centre, CAS Software AG, Karlsruhe, Germany  2  IT Innovation, University of Southampton, Southampton, United Kingdom  3  School of Computing and Communication, Lancaster University, Lancaster, United Kingdom"
650,651,"RACON Software GmbH, Austria  2  Software Competence Center Hagenberg, Austria  3  Johannes Kepler University Linz, Austria"
651,652,"Dept  of Computer Systems, University of S o Paulo   USP, S o Carlos, SP, Brazil  2  IRISA Research Institute, University of South Brittany, Vannes, France"
652,653,"Faculty of Mathematics and Physics, Charles University in Prague, Prague, Czech Republic  2  Institute of Computer Science, Academy of Sciences of the Czech Republic, Prague, Czech Republic"
653,654,"Universit t Hamburg, Vogt K lln Str  30, 22527 Hamburg, Germany"
654,655,"Databases and Distributed Systems Group  DVS , TU Darmstadt, Germany"
655,656,"Vestel Electronics, Manisa, Turkey  2  Department of Computer Science, Ozyegin University, Istanbul, Turkey"
656,657,"Johannes Kepler University Linz, Austria"
657,658,"Carnegie Mellon Software Engineering Institute, United States  2  VU University Amsterdam, Netherlands"
658,659,"Open University, Milton Keynes, United Kingdom  2  Inria Paris Rocquencourt, France"
659,660,"Dipartimento di Ingegneria Elettrica e dell Informazione, Politecnico di Bari, Via E  Orabona, 4, 70125 Bari, Italy"
660,661,"Andaluc a Tech, Universidad de M laga, Spain"
661,662,"Ptidej Team, DGIGL,  cole Polytechnique de Montr al, Canada  2  D partement d Informatique, Universit  du Qu bec   Montr al, Canada"
662,663,"CDL Flex, Institute of Software Technology and Interactive Systems, Vienna University of Technology, Favoritenstrasse 9 188, 1040 Vienna, Austria"
663,664,"Project Group Mechatronic Systems Design, Fraunhofer IPT, Zukunftsmeile 1, 33102 Paderborn, Germany  2  Univ  Nice Sophia Antipolis, I3S, UMR 7271 CNRS, Sophia Antipolis, France"
664,665,"Software Composition Group, University of Bern, 3012 Bern, Switzerland"
665,666,"Federal University of Para ba, Jo o Pessoa, PB, Brazil  2  Federal University of Rio Grande Do Norte, Natal, RN, Brazil  3  University of S o Paulo, S o Carlos, SP, Brazil"
666,667,"Dept  of Information Engineering, Computer Science and Mathematics, University of l Aquila, 67100 L Aquila, Italy"
667,668,"Software Engineering Group, Heinz Nixdorf Institute, University of Paderborn, Germany"
668,669,"Databases and Distributed Systems, TU Darmstadt, Darmstadt, Germany"
669,670,"Atmosphere and Climate Sciences Group  ACSG , Earth and Climate Science Area  ECSA , NRSC, Hyderabad, India"
670,671,"Atmospheric and Climate Sciences Group  ACSG , Earth and Climate Science Area  ECSA , NRSC, Hyderabad, India"
671,672,"ENSTA Bretagne, 2 rue Fran ois Verny, 29806 Brest Cedex 9, France  2  Universit  Bretagne Sud, Rue de Saint Maud , 56321 Lorient Cedex, France"
672,673,"Swedish Institute of Computer Science  SICS , SE 164 29 Kista, Sweden"
673,674,"Software Engineering Group, Kiel University, Germany  2  Helmholtz Research School for Ocean System Science and Technology  HOSST , GEOMAR   Helmholtz Centre for Ocean Research, Kiel, Germany"
674,675,"Utrecht University, Princetonplein 5, 3584 CC Utrecht, Netherlands"
675,676,"Software Architecture Research Group, University of Vienna, Austria"
676,677,"VTT Technical Research Centre of Finland, Kaitov yl  1, 90571 Oulu, Finland"
677,678,"Department of Computer Science, University of Illinois at Chicago, Chicago, IL, United States  2  Software Engineering Institute, Carnegie Mellon University, Pittsburgh, PA, United States"
678,679,"Aselsan, MGEO Division, Etlik, 06011 Ankara, Turkey  2  Bilkent University, Computer Engineering Department, Bilkent, 06800 Ankara, Turkey"
679,680,"Institute for Information Systems and New Media, Vienna University of Economics and Business  WU Vienna , Welthandelsplatz 1, 1020 Vienna, Austria"
680,681,"Research Laboratory ReDCAD, FSEGS, University of Sfax, Tunisia  2  Research Laboratory ReDCAD, ISIMS, University of Sfax, Tunisia  3  LAAS CNRS, Univ  de Toulouse, France"
681,682,"MilSOFT Software Technologies, Ankara, Turkey  2  ASELSAN, Ankara, Turkey  3  Bilkent University, Dept  of Computer Engineering, Ankara, Turkey"
682,683,"Information and Computing Sciences, Utrecht University, Princetonplein 5, 3584 CC Utrecht, Netherlands  2  Center of Informatics, Federal University of Pernambuco, Recife, Brazil"
683,684,"University of Groningen, Groningen, Netherlands  2  University of Canterbury, Christchurch, New Zealand"
684,685,"LIUPPA, University of Pau, BP1155, 640014 Pau, France  2  LIUPPA, University of Pau, BP 201, 40004 Mont de Marsan, France  3  CNRS IRIT, Toulouse University, F 31062 Toulouse, France"
685,686,"Center of Informatics, Federal University of Pernambuco, Recife, Brazil  2  Chalmers University Technology, Gothenburg, Sweden  3  SINTEF ICT, Norway  4  Mannheim University of Applied Sciences, Mannheim, Germany  5  Fraunhofer Institute for Experimental Software Engineering  IESE , Kaiserslautern, Germany  6  Software Composition Group, University of Berne, Berne, Switzerland"
686,687,"Federal University of Goi s, Go nia, Brazil  2  University of S o Paulo   USP, S o Carlos, Brazil  3  IRISA, Universit  de Bretagne Sud  UBS , Vannes, France"
687,688,"Software Composition Group, University of Bern, Switzerland"
688,689,"Norwegian Computing Center, Blindern, NO 0314 Oslo, Norway  2  Point Transaction Systems AS, Pb 73  kern,  stre Aker vei 24, N 0508 Oslo, Norway  3  University of Ljubljana, Trzaka c  25, 1000 Ljubljana, Slovenia"
689,690,"Software Technology Group, Technische Universit t Dresden, Germany"
690,691,"Mobile Communications Research Group, Center for Communication System Research, University of Surrey, Guildford, GU2 7XH, United Kingdom  2  2B Rigel House, Adastral Park, Martlesham Heaty, Ipswich, IPS 3RE, United Kingdom"
691,692,"Mobile Commun  Res  Group, Surrey Univ , Guildford, United Kingdom"
692,693,"sd m Res , Munich, Germany"
693,694,"Nat  ICT Australia, Sydney, NSW, Australia"
694,695,"Dept  of Inf  Technol , Sofia Univ , Sofia, Bulgaria"
695,696,"Dept  of Math    Comput  Sci , Eindhoven Univ  of Technol , Eindhoven, Netherlands"
696,697,"LSR, IMAG, Grenoble, France"
697,698,"Software Eng  Group, Oldenburg Univ , Oldenburg, Germany"
698,699,"Dept  of Software Eng , Charles Univ , Prague, Prague, Czech Republic"
699,700,"4Soft GmbH, Munich, Germany"
700,701,"Dept  of Comput  Sci    Eng , Southeast Univ , Nanjing, Nanjing, China"
701,702,"Fac  of Inf    Commun  Technol , Swinburne Univ  of Technol , Hawthorn, Vic , Australia"
702,703,"Dept  of Software Eng , Erlangen Nurnberg Univ , Erlangen, Germany"
703,704,"Inst  fur Softwaretech    Theor  Informa , Tech  Univ  Berlin, Berlin, Germany"
704,705,"Dept  of Comput  Sci    Electron , Malardalen Univ , Vasteras, Sweden"
705,706,"Istituto di Scienza e Tecnologie dell Informazione, CNR, Pisa, Italy"
706,707,"Dipt  di Inf , Tor Vergata Univ , Rome, Italy"
707,708,"Dept  de Inf , FCT UNL, Lisbon, Portugal"
708,709,"Distrinet, KU Leuven, Belgium"
