,affilID,affiliation
709,710,"Dept  de Inf , Univ  Tecnica Federico Santa Maria, Valparaiso, Chile"
710,711,"Dipt  di Inf , Univ  di L Aquila, L Aquila, Italy"
711,712,"Ist  di Sci  e Tecnol  dell Inf , Pisa, Italy"
712,713,"Karlsruhe Univ , Karlsruhe, Germany"
713,714,"Tufts Univ , Boston, MA, United States"
714,715,"Tech  Univ  of Braunschweig, Braunschweig, Germany"
715,716,"Technical University of Braunschweig, 38106 Braunschweig, Germany"
716,717,"King s College London, Strand, London, WC2R2LS, United Kingdom"
717,718,"Istituto di Scienza e Tecnologie dell Informazione A  Faedo  ISTI CNR , Area Della Ricerca CNR di Pisa, 56100 Pisa, Italy  2  University of L Aquila, Computer Science Department, Via Vetoio 1, 67010 L Aquila, Italy  3  IMT Graduate School, Via San Micheletto, 3, 55100 Lucca, Italy"
718,719,"Department of Computer Science, University of York, York YO10 5DD, United Kingdom"
719,720,"Department of Computer Science, University of Aarhus, Aabogade 34, 8200 Aarhus M, Sweden  2  Department of Computer Science, Lund University, Ole R mers v g 3, 223 63 Lund, Sweden  3  PalCom Project"
720,721,"National ICT Australia  NICTA , School of Computer Science and Engineering, University of New South Wales, Australia  2  Software Engineering Institute, United States  3  Engineering Faculty, University of Technology Sydney"
721,722,"Distrinet, KULeuven, Celestijnenlaan 200A, Leuven, Belgium"
722,723,"Universidad T cnica Federico Santa Mar a, Departamento de Inform tica, Avenida Espa a 1680, Valpara so, Chile  2  Universidad Diego Portales, Escuela de Ingenier a Inform tica, Av  Ej rcito 441, Santiago, Chile"
723,724,"Dipartimento di Informatica, Universit  di L Aquila, L Aquila, Italy  2  Dipartimento di Elettronica e Informazione, Politecnico di Milano, Milano, Italy"
724,725,"University of British Columbia, Vancouver, BC, Canada  2  Vrije Universiteit, Amsterdam, Netherlands"
725,726,"School of Information Technology and Electrical Engineering, ARC Centre for Complex Systems, University of Queensland, St Lucia, QLD 4072, Australia"
726,727,"Microsoft Res , Redmond, WA, United States"
727,728,"Hamburg Univ , Hamburg, Germany"
728,729,"Software   Appl  Technol  Lab , Nokia Res  Center, Helsinki, Finland"
729,730,"Grad  Sch  Trustsoft, Oldenburg Univ , Oldenburg, Germany"
730,731,"Dept  of Comput  Sci , York Univ , York, United Kingdom"
731,732,"Sch  of Inf  Technol    Electr  Eng , Queensland Univ , Brisbane, Qld , Australia"
732,733,"King s Coll  London, London, United Kingdom"
733,734,"King s College London, Strand, London WC2R2LS, United Kingdom"
734,735,"Software Engineering Institute, 4500 Fifth Av , Pittsburgh, PA 15213 3890, United States  2  ISISTAN Research Institute, Facultad de Cs  Exactas, Pje  Arroyo Seco   Campus Universitario,  7000  Tandil, Buenos Aires, Argentina  3  CONICET, Argentina"
735,736,"Lero, University of Limerick, Ireland  2  Software Engineering Institute, Carnegie Mellon University, United States  3  Pacific Northwest National Laboratory, United States"
736,737,"VU University Amsterdam, Netherlands  2  University of Groningen, Netherlands"
737,738,"Software Systems Process Informatics Group, Technical University of Ilmenau, Germany"
738,739,"IBM Research GmbH, Zurich Research Laboratory, S umerstrasse 4, R schlikon 8803, Switzerland  2  Institute of Architecture of Application Systems, Universit t Stuttgart, Universit tsstrae 38, Stuttgart 70569, Germany"
739,740,"Graduate School Trustsoft, University of Oldenburg, Germany  2  Department of Software Design and Quality, University of Karlsruhe, Germany"
740,741,"LogicaCMG, P O  Box 159, Amstelveen 1180 AD, Netherlands  2  LogicaCMG, Stephenson House, 75 Hampstead Road, London NW1 2PL, United Kingdom  3  Eindhoven Univ  of Technol , P O  Box 513, Eindhoven 5600 MB, Netherlands"
741,742,"Dept  of Systems and Computer Engineering, Carleton University, Ottawa, Canada"
742,743,"Computer Science and Software Engineering Department, Seattle University, Seattle, WA 98122, United States  2  Computer Science Department, University of Southern California, Los Angeles, CA 90089, United States  3  EE Systems Department, University of Southern California, IMSC, Los Angeles, CA 90089, United States"
743,744,"INFN Sezione di Padova, via Marzolo 8, Padova 35131, Italy  2  Dip  di Elettronica e Informazione, Politecnico di Milano, via Ponzio 34 5, Milano 20133, Italy"
744,745,National ICT Australia
745,746,"TU Clausthal  2  Univ  Karlsruhe  TH    FZI  3  Politecnico Milano  4  Charles University, Prague"
746,747,"Dipartimento di Informatica, Universit  dell Aquila, Via Vetoio, 67010 Coppito  AQ , Italy  2  TechnoLabs S p A , S S  17 Localit  Boschetto, 67100 L Aquila  AQ , Italy  3  Accenture S p A , Largo Donegani 2, 20121 Milano, Italy"
747,748,"Dipartimento di Elettronica e Informazione, Politecnico di Milano, Piazza Leonardo da Vinci 32, 20133 Milano, Italy"
748,749,"Software Engineering Institute, Carnegie Mellon University, 4500 Fifth Avenue, Pittsburgh, PA 15213 2612, United States"
749,750,"Department of Mathematics and Computing Science, University of Groningen, P O  Box 800, 9700AV Groningen, Netherlands  2  ASML, DE SSD, Litho Systems Architecture, 5504DR Veldhoven, Netherlands  3  Previously Employed by ASTRON, P O  Box 2, 7990AA Dwingeloo, Netherlands"
750,751,"Software Engineering Institute, Carnegie Mellon University, Pittsburgh, PA, United States"
751,752,"DeepSe Group Dipartimento di Elettronica e Informazione, Politecnico di Milano, Piazza Leonardo Da Vinci, 32, 20133 Milano, Italy"
752,753,"Universit  Lille 1, LIFL, INRIA, 40, avenue Halley, 59650 Villeneuve d Ascq, France"
753,754,"INRIA Lille, Nord Europe, UMR 8022, France  2  Distributed Systems Research Group, Charles University in Prague, Czech Republic  3  Institute of Computer Science, Academy of Sciences of the Czech Republic"
754,755,"Institut TELECOM, TELECOM Bretagne, Technopole Brest Iroise, CS 83818, 29238 Brest Cedex 3, France"
755,756,"Capgemini, Global Financial Services, Architecture and Governance Improvement, Papendorpseweg 100, 3528 BJ Utrecht, Netherlands  2  Department of Computer Science, VU University, De Boelelaan 1081a, 1081 HV Amsterdam, Netherlands"
756,757,"Sdandm AG, Carl Wery Strae 42, 81739 M nchen, Germany  2  Brandenburg University of Technology, Postbox 101344, 03013 Cottbus, Germany  3  University of Paderborn, S lab, Warburger Str  100, 33098 Paderborn, Germany"
757,758,"National ICT Australia, Australia  2  Lero, Irish Software Engineering Centre, University of Limerick, Ireland  3  Pacific Northwest National Laboratory, United States"
758,759,"Dept  of Syst    Comput  Eng , Carleton Univ , Ottawa, ON, Canada"
759,760,"INFN Sezione di Padova, Padova, Italy  2  Dip  di Elettron  e Inf , Politec  di Milano, Milan, Italy"
760,761,"Software Syst  Process Inf  Group Tech , Univ  of Ilmenau, Ilmenau, Germany"
761,762,"Comput  Sci    Software Eng  Dept , Seattle Univ , Seattle, WA, United States  2  Comput  Sci  Dept , Univ  of Southern California, Los Angeles, CA, United States  3  EE Syst  Dept , Univ  of Southern California, Los Angeles, CA, United States"
762,763,"VU Univ  Amsterdam, Amsterdam, Netherlands  2  Univ  of Groningen, Groningen, Netherlands"
763,764,"Syst  Eng    Comput  Sci  Program, Fed  Univ  of Rio de Janeiro, Rio de Janeiro, Brazil"
764,765,"Dept  of Comput  Sci , VU Univ , Amsterdam, Netherlands"
765,766,"Univ  of Limerick, Limerick, Ireland  2  Software Eng  Inst , Carnegie Mellon Univ , Pittsburgh, PA, United States  3  Pacific Northwest Nat  Lab , Richland, WA, United States"
766,767,"LogicaCMG, Amstelveen, Netherlands  2  LogicaCMG, London, United Kingdom  3  Eindhoven Univ  of Technol , Eindhoven, Netherlands"
767,768,"Software Eng  Inst , Pittsburgh, PA, United States  2  ISISTAN Res  Inst , UNICEN Univ , Buenos Aires, Argentina"
768,769,"Zurich Res  Lab , IBM Res  GmbH, Ruschlikon, Switzerland  2  Inst  of Archit  of Applic  Syst , Univ  Stuttgart, Stuttgart, Germany"
769,770,"Grad  Sch  Trustsoft, Univ  of Oldenburg, Oldenburg, Germany"
770,771,"INRIA Lille, Project ADAM USTL LIFL CNRS UMR 8022, Lille, France"
771,772,"sd m AG, Munich, Germany"
772,773,"Capgemini  Global Financial Services, Archit    Governance Improvement, Utrecht, Netherlands"
773,774,"Dipt  di Inf , Univ  del Aquila, Coppito, Italy"
774,775,"DeepSE Group Dipt  di Elettron  e Inf , Politec  di Milano, Milan, Italy"
775,776,"Swinburne Univ  of Technol , Melbourne, VIC, Australia"
776,777,"Software Eng  Inst , Carnegie Mellon Univ , Pittsburgh, PA, United States"
777,778,"Dipt  di Elettron  e Inf , Politec  di Milano, Milano, Italy"
778,779,"INRIA 40, LIFL CNRS UMR 8022   INRIA 40, Villeneuve d Ascq, France"
779,780,"Inst  TELECOM, TELECOM Bretagne, Brest, France"
780,781,"Dept  of Math    Comput  Sci , Groningen Univ , Groningen, Netherlands"
781,782,"Software Design and Quality Group, Universit t Karlsruhe  TH , Germany  2  Software Engineering for Business Information Systems, Technische Universit t M nchen, Germany"
782,783,"Universit  Lille 1, LIFL CNRS UMR 8022, INRIA, Villeneuve d Ascq 59650, France"
783,784,"L L Bean, Inc , Freeport, ME, United States  2  Lattix, Inc , Andover, MA, United States  3  Tufts University, Medford, MA, United States"
784,785,"ISIS, Dept  of EECS, Vanderbilt University, Nashville, TN, United States"
785,786,"ABB Corporate Research, Industrial Software Systems, Wallstadter Str  59, Ladenburg 68526, Germany"
786,787,"University of Southern California, Los Angeles, CA, United States"
787,788,"Politecnico di Milano, DEI, Via Ponzio 34 5, Milan I 20133, Italy"
788,789,"School of IDE, M lardalen University, Box 883, V ster s 72123, Sweden  2  Faculty of ICT, Swinburne University of Technology, Hawthorn VIC 3122, Australia"
789,790,"Logica, P O  Box 159, 1180 AD Amstelveen, Netherlands  2  VU University, Amsterdam, Netherlands"
790,791,"Argonne National Laboratory, Argonne, IL, United States  2  Sandia National Laboratories, Livermore, CA, United States  3  Ames Laboratory, Ames, IA, United States  4  University of Oregon, Eugene, OR, United States  5  Ochanomizu University, Japan"
791,792,"Software Technology Group, V xj  University, Sweden  2  Embedded Control Systems, Royal Institute of Technology, Sweden"
792,793,"Department of Computer Science, King s College London Strand, London WC2R 2LS, United Kingdom"
793,794,"SAP Research, CEC Karlsruhe, Germany  2  TU Darmstadt, Germany  3  Karlsruhe Institute of Technology  KIT , Germany"
794,795,"FZI Karlsruhe, Haid und Neu Str  10 14, 76131 Karlsruhe, Germany  2  ABB Corporate Research, Wallstadter Str  59, 68526 Ladenburg, Germany  3  Masaryk University, Botanicka 68a, 60200 Brno, Czech Republic"
795,796,"Alkante SAS, Rennes, France  2  IRISA Triskell, Campus Universitaire de Beaulieu, Rennes, France  3  Valoria, Universit  de Bretagne Sud, Vannes, France"
796,797,"Faculty of ICT, Swinburne University of Technology, Hawthorn, VIC 3122, Australia  2  Faculty of Informatics, Masaryk University, 60200 Brno, Czech Republic"
797,798,"Key Laboratory of High Confidence Software Technologies, School of Electronics Engineering and Computer Science, Peking University, Beijing, 100871, China"
798,799,"Politecnico di Milano, Dipartimento di Elettronica e Informazione, Deep SE Group, Via Golgi 42, 20133 Milano, Italy"
799,800,"Karlsruhe Institute of Technology, Karlsruhe, Germany  2  Politecnico di Milano, Dipartimento di Elettronica e Informazione, Milano, Italy  3  ABB Corporate Research, Ladenburg, Germany"
800,801,"Departmet for Software Design and Quality, Universit t Karlsruhe  TH , 76131 Karlsruhe, Germany  2  FZI Forschungszentrum Informatik, 76131 Karlsruhe, Germany"
801,802,"Department of Distributed and Dependable Systems, Faculty of Mathematics and Physics, Charles University, Malostransk  n m st  25, 118 00 Prague, Czech Republic  2  Institute of Computer Science, Academy of Sciences of the Czech Republic, Pod Vod renskou vez  2, 182 07 Prague, Czech Republic"
802,803,"Massey University, School of Engineering and Advanced Technology, Palmerston North, New Zealand  2  Department of Computer Science, University of Auckland, Auckland, New Zealand"
803,804,"Component and Service Engineering Group, Business Informatics and Systems Engineering Department, University of Augsburg, Universitaetsstrasse 16, 86159 Augsburg, Germany"
804,805,"Imperial Coll  London, London, United Kingdom"
805,806,"FZI Research Center for Information Technology, Karlsruhe, Germany  2  Karlsruhe Institute of Technology, Karlsruhe, Germany"
806,807,"Research Center for Information Technology  FZI , Karlsruhe, Germany  2  Masaryk University, Brno, Czech Republic  3  Industrial Software Systems, ABB Corporate Research, Ladenburg, Germany  4  Karlsruhe Institute of Technology  KIT , Karlsruhe, Germany"
807,808,"Dpto  de Inform tica e Ingenier a de Sistemas, Universidad de Zaragoza, Zaragoza, Spain  2  Politecnico di Milano, Dipartimento di Elettronica e Informazione, Milano, Italy"
808,809,"Dpto  de Inform tica e Ingenier a de Sistemas, Universidad de Zaragoza, Zaragoza, Spain  2  Dip  di Elettronica e Informazione, Politecnico di Milano, Milano, Italy"
809,810,"Institute for Information Processing Technologies  ITIV , Karlsruhe Institute of Technology  KIT , Vincenz Prienitz Strae 1, Karlsruhe, Germany  2  FZI Forschungszentrum Informatik, Haid und Neu Strae 10 14, Karlsruhe, Germany"
810,811,"Software Engineering  SE , IT Research Center FZI, 76131 Karlsruhe, Germany"
811,812,"School of Computer Science and Information Technology, RMIT University, Melbourne, VIC, Australia"
812,813,"University of Pisa, IIT CNR, Pisa, Italy  2  IIT CNR, Pisa, Italy"
813,814,"School of Computer Science and IT, RMIT University, Melbourne, VIC, Australia"
814,815,"Industrial Software Systems, ABB Corporate Research, Ladenburg, Germany"
815,816,"Federal University of Pernambuco, P O  Box 7851, 50732 970 Recife   PE, Brazil  2  Federal University of Bahia and RiSE, Campus de Ondina, Av  Adhemar de Barros, S N, 40170 110 Salvador   BA, Brazil"
816,817,"Department of Systems and Computer Engineering, Carleton University, Ottawa, ON K1S 5B6, Canada  2  GTS Architecture and Technical Solution Design, IBM, Durham, NC 27703, United States"
817,818,"Dept  of EECS, Vanderbilt University, Nashville, TN 37235, United States  2  Dept  of CS, University of Alabama, Tuscaloosa, AL 35487, United States"
818,819,"Karlsruhe Institute of Technology, Karlsruhe, Germany  2  ABB Corporate Research, Ladenburg, Germany"
819,820,"School of Computing, Queen s University, Kingston, ON, Canada"
820,821,"Department of Computer Science, North Dakota State University, Fargo, ND, United States  2  National Center for the Protection of the Financial Infrastructure, Dakota State University, Madison, SD, United States"
821,822,"Heinz Nixdorf Institute, Department of Computer Science, University of Paderborn, Paderborn, Germany"
822,823,"University of Kaiserslautern, AG Software Engineering  Dependability, 67653 Kaiserslautern, Germany"
823,824,"Faculty of Information and Communication Technologies, Swinburne University of Technology, Hawthorn, VIC 3122, Australia  2  Faculty of Computer Science, Center for Mathematical and Computational Modelling  CM , University of Kaiserslautern, D 67653, Kaiserslautern, Germany"
824,825,"Institute of Software, Chinese Academy of Sciences, Graduate University of Chinese Academy of Sciences, Beijing, China  2  Institute of Software, Chinese Academy of Sciences, Beijing, China"
825,826,"Fraunhofer IESE, Fraunhofer Platz 1, 67663 Kaiserslautern, Germany  2  Karlsruhe Institute of Technology  KIT , Am Fasanengarten 5, 76131 Karlsruhe, Germany"
826,827,"Karlsruhe Institute of Technology, Am Fasanengarten 5, Karlsruhe, Germany"
827,828,"SAP AG, 69190 Walldorf, Germany  2  Karlsruhe Institute of Technology, 76131 Karlsruhe, Germany"
828,829,"Eindhoven University of Technology, 5612 AZ Eindhoven, Netherlands  2  DAF Trucks NV, P O  Box 90065, 5600 PT Eindhoven, Netherlands"
829,830,"Universit  degli Studi dell Aquila, 67100 L Aquila, Italy"
830,831,"Dipartimento di Informatica, Universit  degli Studi dell Aquila, Via Vetoio, Coppito, 67010, L Aquila, Italy"
831,832,"Paluno   The Ruhr Institute for Software Technology, University of Duisburg, Essen, Germany"
832,833,"FZI Forschungszentrum Informatik, Haid und Neu Str  10 14, 76131 Karlsruhe, Germany"
833,834,"Software Architecture Group, Faculty of Computer Science, University of Vienna, Austria"
834,835,"University of Trento, Italy"
835,836,"Lero The Irish Software Engineering Research Centre, University of Limerick, Limerick, Ireland"
836,837,"Department of Computer Science, Wayne State University, United States"
837,838,"Chalmers University of Technology Software, Engineering Div , Dept  of Computer Science and Engineering, SE 412 96 G teborg, Sweden"
838,839,"Department of Computer Science, University of Bologna, Mura A  Zamboni 7, I 40126 Bologna, Italy"
839,840,"NICTA ANU, Canberra Research Laboratory, 7A London Circuit, Canberra, Australia"
840,841,"Institute for Software Research, Carnegie Mellon University, 5000 Forbes Avenue, Pittsburgh, PA 15213, United States"
841,842,"Software Engineering  SE , Research Center for Information Technology, FZI 76131 Karlsruhe, Germany  2  Software Design and Quality  SDQ , Karlsruhe Institute of Technology, KIT 76131 Karlsruhe, Germany"
842,843,"Faculty of Information and Communication Technologies, Swinburne University of Technology, Hawthorn, VIC 3122, Australia  2  CA Labs, 380 St  Kilda Rd, Melbourne, VIC 3004, Australia"
843,844,"Eindhoven University of Technology, 5612 AZ Eindhoven, Netherlands"
844,845,"George Mason University, 4400 University Drive, Fairfax, VA, 22030, United States  2  Carnegie Mellon University, 5000 Forbes Avenue, Pittsburgh PA, 15213, United States"
845,846,"Faculty of Information and Communication Technologies, Swinburne University of Technology, Hawthorn, VIC 3122, Australia  2  CA Labs, 380 St  Kilda Rd , Melbourne, VIC 3004, Australia"
846,847,"University of L Aquila, Italy  2  Portland House Group, Australia  3  Monash University, Australia  4  Universit t Stuttgart, Germany"
847,848,"FZI Research Center for Information Technology, Haid und Neu Str  10 14, Karlsruhe, Germany"
848,849,"Software Engineering Group, Heinz Nixdorf Institute, University of Paderborn, Zukunftsmeile 1, 33102 Paderborn, Germany  2  Department of Computer Science, University of Paderborn, Zukunftsmeile 1, 33102 Paderborn, Germany"
849,850,"INRIA Lille   Nord Europe, LIFL   UMR CNRS 8022, Univ  Lille 1, France  2  I3S   UMR CNRS 7271, Univ  Nice Sophia Antipolis, Nice, France"
850,851,"Software Engineering Institute, Pittsburgh, PA, United States  2  VU Amsterdam, Amsterdam, Netherlands"
851,852,"Dept  of Computer Science, Drexel University, Philadelphia, PA, United States  2  State Key Laboratory for Novel Software Technology, Dept  of Computer Science and Technology, Nanjing University, Nanjing, 210046, China  3  Clinical Solutions R and D, Siemens Healthcare, Malvern, PA, United States"
852,853,"Department of Computer Science and Eng , Indian Institute of Technology Kanpur, Kanpur, 208016, India  2  Department of Computer Science and Eng , Indian Institute of Technology Ropar, Ropar, 140001, India"
853,854,"Paluno   The Ruhr Institute for Software Technology, University of Duisburg Essen, 45127 Essen, Germany  2  Software Design and Quality  SDQ , Karlsruhe Institute of Technology  KIT , 76131 Karlsruhe, Germany"
854,855,"ESolutions, Monash University, Melbourne, Australia  2  CSIT School, RMIT University, Melbourne, Australia"
855,856,"Software Systems Research Group, NICTA, Sydney, Australia  2  School of Computer Science and Engineering, University of New South Wales, Sydney, Australia"
856,857,"Software Systems Engineering, University of Hildesheim, Germany"
857,858,"Bilkent University, Department of Computer Engineering, 06800 Bilkent Ankara, Turkey"
858,859,"Department of Information Engineering, Computer Science and Mathematics, University of L Aquila, L Aquila, Italy  2  Business Informatics Group, Vienna University of Technology, Vienna, Austria"
859,860,"Embedded Systems Team, CERIE, ESTACA Laval, France  2  MOCS, CACS Team, Lab STICC, UEB, UBO, Brest, France"
860,861,"WirelessVT, Bradley Dept  of Electrical and Computer Engineering, Virginia Tech, Blacksburg  VA, United States"
861,862,"National Key Lab of Integrated Information System Technology, Institute of Software, Chinese Academy of Sciences, Beijing, China  2  Graduate University of Chinese Academy of Sciences, Beijing, China"
862,863,"Institute for Program Structures and Data Organization, Karlsruhe Institute of Technology  KIT , Karlsruhe, Germany"
863,864,"Department of Computer, Science and Engineering, Aalto University, Finland  2  Danfoss, Denmark  3  University of Helsinki, Finland"
864,865,"Karlsruhe Institute of Technology, Am Fasanengarten 5, Karlsruhe, Germany  2  SAP AG, Vincenz Priessnitz Strasse 1, Karlsruhe, Germany"
865,866,"Department of Mathematics and Computer Science, University of Groningen, Nijenborgh 9, 9747 AG Groningen, Netherlands  2  Computer Science and Communications Research Unit, University of Luxembourg, 6, rue Richard Coudenhove Kalergi, L 1359, Luxembourg  3  State Key Lab of Software Engineering, School of Computer, Wuhan University, Luojiasha 430072, Wuhan, China"
866,867,"ABB Corporate Research, V steras, Sweden  2  ABB Corporate Research, Raleigh, NC, United States"
867,868,"Politecnico di Milano Dipartimento di Elettronica, Informazione e Bioingegneria, Milano, Italy"
868,869,"Dept  of Computer Science, Linnaeus University, Kalmar, Sweden  2  Dept  of Computer Science and Engineering, Chalmers University of Technology, University of Gothenburg, Gothenburg, Sweden"
869,870,"Mondragon Unibertsitatea, Mondragon, Spain  2  Gran Sasso Science Institute, L Aquila, Italy  3  University of L Aquila, L Aquila, Italy"
870,871,"Fortiss GmbH, Guerickestr  25, 80805 M nchen, Germany  2  Technische Universit t M nchen, Boltzmannstr  3, 85748 Garching, Germany"
871,872,"Computer and Mathematical Sciences, Auckland University of Technology, Auckland 1142, New Zealand  2  Department of Computer Science, University of York, York, YO10 5GH, United Kingdom"
872,873,"Institute for Software Research, Carnegie Mellon University, United States  2  Department of Informatics Engineering, University of Coimbra, Portugal  3  School of Computing, University of Kent, United Kingdom"
873,874,"Masaryk University, Brno, Czech Republic"
874,875,"CES Laboratory, National School of Engineers of Sfax, Sfax, Tunisia  2  CEA, LIST, Laboratory of Model Driven Engineering for Embedded Systems, 91191 Gif sur Yvette, France  3  Lab STICC, UBO, UEB Brest, Brest, France"
875,876,"Interdisciplinary Center for Security Reliability and Trust  SnT , University of Luxembourg, Luxembourg  2  University of Rennes 1, IRISA INRIA Centre, Rennes, France  3  SINTEF ICT, Oslo, Norway"
876,877,"Universidad de Los Andes, Vrije Universiteit Brussel, Belgium  2  Vrije Universiteit Brussel, Belgium  3  Universidad de Los Andes, Colombia"
877,878,"VTT Tech  Res  Centre of Finland, Oulu, Finland"
878,879,"Dept  of Comput  Sci , Sheffield Univ , Sheffield, United Kingdom"
879,880,"Dipt  di Elettron  e Inf , Politecnico di Milano, Milan, Italy"
880,881,"Inst  for Software Res , California Univ , Irvine, Irvine, CA, United States"
881,882,"CWI   Delft Univ  of Technol , Netherlands"
882,883,"Computer Science Department, University of Southern California, Los Angeles, CA 90089, United States  2  School of Computer Science, Carnegie Mellon University, Pittsburgh, PA 15213, United States"
883,884,"VTT Tech  Research Centre of Finland, P  O  Box 1100, FIN 90571 Oulu, Finland"
884,885,"Dep  de Inform tica, Univ  Nova de Lisboa, 2829 516 Caparica, Portugal  2  Dep  of Computer Science, Univ  of Leicester, Leicester LE1 7RH, United Kingdom  3  Dep  de Inform tica, Univ  de Lisboa, 1749 016 Lisboa, Portugal"
885,886,"Institute for System Architecture, TU Dresden, Germany  2  Institute for Software Engineering, TU Dresden, Germany"
886,887,"New South Wales Univ , Sydney, NSW, Australia"
887,888,"Intelligent Syst  Lab , BT Exact, Courbevoie, France"
888,889,"School of Computer Science, University of St Andrews, St Andrews, Fife KY16 9SS, United Kingdom  2  ESIA, Universit  de Savoie, 5 Chemin de Bellevue, 74940 Annecy le Vieux, France  3  Department of Computer Science, University of Manchester, Manchester M13 9PL, United Kingdom"
889,890,"National ICT Australia Ltd , University of New South Wales, Australia"
890,891,Aerospace Corporation  2  George Mason University
891,892,"Jet Propulsion Laboratory, California Institute of Technology, Pasadena, CA 91109, United States  2  Computer Science Department, University of Southern California, Los Angeles, CA 90089, United States"
892,893,"BT Exact, Intelligent Systems Lab , 11, place des Vosges, 92061 Courbevoie, France  2  BT Exact, Intelligent Systems Lab , Adastral Park, Martlesham Heath, Suffolk IP5 3RE, United Kingdom"
893,894,"Dept  de Inf , Univ  Nova de Lisboa, Caparica, Portugal"
894,895,"Dept  of Comput  Sci , Namur Univ , Namur, Belgium"
895,896,"VTT Tech  Res  Centre, Oulu, Finland"
896,897,"Software Technol  Lab , Nokia Res  Center, Finland"
897,898,"Sch  of Comput  Sci , St Andrews Univ , St  Andrews, United Kingdom"
898,899,"Universit  di Urbino Carlo Bo, Ist  Sci  e Tecnologie Informazione, Piazza della Repubblica 13, 61029 Urbino, Italy"
899,900,"Ist  di Sci  e Tecnol  dell Inf , Univ  di Urbino, Urbino, Italy"
900,901,"LogicaCMG, Arnhem, Netherlands"
901,902,"Dept  de Inf  Apl , Univ  Politecnica de Madrid, Madrid, Spain"
902,903,"INRIA, UR Rocquencourt, Domaine de Voluceau, 78153 Le Chesnay, France"
